id,title,selftext,created_utc,subreddit,source,fetched_at
sample01,Handmade soap review - absolutely love it,Love the natural ingredients and the scent lasts all day. Bought from a small Etsy shop. Will definitely order again!,1770810558.4450638,handmade,reddit_sample,2026-02-12T11:49:18.462352+00:00
sample02,Best place to buy handmade gifts?,Looking for small business recommendations for wedding gifts. Prefer something unique and not mass produced.,1770724158.4450638,crafts,reddit_sample,2026-02-12T11:49:18.462352+00:00
sample03,DIY craft ideas for beginners,Share your favorite handmade projects. I want to start with something easy like candles or simple jewelry.,1770637758.4450638,handmade,reddit_sample,2026-02-12T11:49:18.462352+00:00
sample04,Disappointed with my Etsy order,The product looked great in photos but quality was poor. Shipping took 3 weeks. Has anyone had similar experience?,1770551358.4450638,Etsy,reddit_sample,2026-02-12T11:49:18.462352+00:00
sample05,Handmade ceramic vase - worth every penny,Beautiful craftsmanship. Seller was super responsive. Packaging was careful. 10/10 would recommend for home decor.,1770464958.4450638,handmade,reddit_sample,2026-02-12T11:49:18.462352+00:00
sample06,Selling handmade jewelry - pricing advice?,How do you price your time vs materials? I feel like I am undercharging but scared to raise prices.,1770378558.4450638,crafts,reddit_sample,2026-02-12T11:49:18.462352+00:00
sample07,Small business Saturday haul,"Picked up some amazing local handmade soaps, a wooden cutting board, and a knitted scarf. Supporting small businesses feels great!",1770292158.4450638,handmade,reddit_sample,2026-02-12T11:49:18.462352+00:00
sample08,Recommendations for handmade leather wallets?,Looking for durable and stylish. Budget around 50-80. Prefer US or UK sellers with good reviews.,1770205758.4450638,crafts,reddit_sample,2026-02-12T11:49:18.462352+00:00
sample09,First time buying from a craft fair,Got a beautiful hand-painted mug and some beeswax candles. The vendors were so friendly. Will go again next month!,1770119358.4450638,handmade,reddit_sample,2026-02-12T11:49:18.462352+00:00
sample10,Handmade vs mass produced - quality difference?,Do you think handmade items are actually better quality or is it just the idea we pay for? Genuinely curious.,1770032958.4450638,crafts,reddit_sample,2026-02-12T11:49:18.462352+00:00
sample11,Custom order went wrong - seller fixed it,Initial order had a mistake but the seller apologized and sent a replacement quickly. Good customer service matters!,1769946558.4450638,Etsy,reddit_sample,2026-02-12T11:49:18.462352+00:00
sample12,Woodworking gifts for dad,"Looking for handmade wooden items - maybe a pen, box, or small shelf. Any shop recommendations?",1769860158.4450638,handmade,reddit_sample,2026-02-12T11:49:18.462352+00:00
sample13,Crochet blanket took 2 months but so worth it,Made it as a gift. The recipient cried happy tears. Handmade gifts have a different meaning.,1769773758.4450638,crafts,reddit_sample,2026-02-12T11:49:18.462352+00:00
sample14,Bad experience with handmade soap - rash,I have sensitive skin and got a rash. Seller said ingredients were all natural but maybe I am allergic to something. Be careful!,1769687358.4450638,handmade,reddit_sample,2026-02-12T11:49:18.462352+00:00
sample15,How to find reliable handmade sellers?,I want to buy more from small businesses but worried about scams or poor quality. What do you look for in reviews?,1769600958.4450638,Etsy,reddit_sample,2026-02-12T11:49:18.462352+00:00
sample16,Handmade candles - best scents for relaxation?,Looking for lavender or eucalyptus. Prefer soy wax. Drop your favorite shops below!,1769514558.4450638,handmade,reddit_sample,2026-02-12T11:49:18.462352+00:00
sample17,Started my small craft business - tips?,Selling on Etsy and at local markets. What helped you most in the first year? Photography? Pricing? Marketing?,1769428158.4450638,crafts,reddit_sample,2026-02-12T11:49:18.462352+00:00
sample18,Beautiful handmade necklace - fast shipping,"Ordered on Monday, arrived Friday. Exactly as described. Seller even included a thank you note. Small touches matter.",1769341758.4450638,handmade,reddit_sample,2026-02-12T11:49:18.462352+00:00
sample19,Disaster with custom embroidery order,Name was spelled wrong and they refused to fix it. Had to open a dispute. Really disappointed.,1769255358.4450638,Etsy,reddit_sample,2026-02-12T11:49:18.462352+00:00
sample20,Handmade pottery - where to start as buyer?,I want to buy a nice handmade bowl or plate. What should I look for in terms of quality and finish?,1769168958.4450638,crafts,reddit_sample,2026-02-12T11:49:18.462352+00:00
sample21,Local artist made this painting - in love,Support your local artists! Bought at a pop-up market. The quality and uniqueness beat any big store.,1769082558.4450638,handmade,reddit_sample,2026-02-12T11:49:18.462352+00:00
sample22,Handmade skincare - worth the hype?,Seeing a lot of small batch face oils and serums. Are they actually better or just marketing? Would love honest reviews.,1768996158.4450638,crafts,reddit_sample,2026-02-12T11:49:18.462352+00:00
sample23,Amazing experience with a small jewelry maker,She customized the design based on my ideas. Communication was perfect. The ring is stunning. Could not be happier!,1768909758.4450638,handmade,reddit_sample,2026-02-12T11:49:18.462352+00:00
sample24,Shipping took 6 weeks - never again,"Item was handmade to order which I get, but 6 weeks with no update? Poor communication. Product was ok but experience was bad.",1768823358.4450638,Etsy,reddit_sample,2026-02-12T11:49:18.462352+00:00
sample25,Gift ideas for someone who loves handmade,My friend only buys from small businesses. Budget 30-50. Thinking maybe a basket of small items? Ideas welcome.,1768736958.4450638,handmade,reddit_sample,2026-02-12T11:49:18.462352+00:00
sample26,Knitted scarf from Etsy - perfect for winter,"Soft wool, great colors. Seller was from my state so shipping was quick. Will buy again for gifts.",1768650558.4450638,crafts,reddit_sample,2026-02-12T11:49:18.462352+00:00
sample27,Handmade furniture - quality check?,Considering a custom wooden desk. How do I verify the seller is legit and the wood is solid? Any red flags?,1768564158.4450638,handmade,reddit_sample,2026-02-12T11:49:18.462352+00:00
sample28,Support small - bought 5 Christmas gifts from Etsy,All different sellers. Each item was wrapped with care. Took more time to choose but felt good about where money went.,1768477758.4450638,Etsy,reddit_sample,2026-02-12T11:49:18.462352+00:00
sample29,Handmade paper and stationery,Looking for recycled or artisan paper for letter writing. Anyone have a favorite shop? US based preferred.,1768391358.4450638,crafts,reddit_sample,2026-02-12T11:49:18.462352+00:00
sample30,Disappointed with quality of handmade bag,Stitching came loose after 2 weeks. Seller said it was normal wear. For the price I expected better. Not sure I would recommend.,1768304958.4450638,handmade,reddit_sample,2026-02-12T11:49:18.462352+00:00
sample31,Best handmade items under 20 dollars?,Want to support small businesses without breaking the bank. What are your go-to affordable handmade purchases?,1768218558.4450638,crafts,reddit_sample,2026-02-12T11:49:18.462352+00:00
sample32,Custom pet portrait - turned out amazing,Commissioned for my mom. The artist captured our dog perfectly. She cried when she opened it. Best gift ever!,1768132158.4450638,handmade,reddit_sample,2026-02-12T11:49:18.462352+00:00
sample33,Handmade soap subscription box,Has anyone tried one? Looking for a monthly surprise of small batch soaps. Recommendations?,1768045758.4450638,handmade,reddit_sample,2026-02-12T11:49:18.462352+00:00
sample34,Etsy seller sent wrong item - quick fix,They apologized and sent the correct one plus let me keep the mistake. Great customer service. Will order again.,1767959358.4450638,Etsy,reddit_sample,2026-02-12T11:49:18.462352+00:00
sample35,Handmade toys for kids - safety?,Want to buy wooden toys from a craft seller. Are there safety standards I should ask about? Paint and finish concerns.,1767872958.4450638,crafts,reddit_sample,2026-02-12T11:49:18.462352+00:00
sample36,Bought a handmade quilt - heirloom quality,The detail is incredible. Took the maker 3 months. You can tell it was made with love. Worth every penny.,1767786558.4450638,handmade,reddit_sample,2026-02-12T11:49:18.462352+00:00
sample37,How do you package handmade items for shipping?,New seller here. What packaging do you use to keep things safe and still look professional? Eco-friendly options?,1767700158.4450638,crafts,reddit_sample,2026-02-12T11:49:18.462352+00:00
sample38,Handmade honey and beeswax products,Local beekeeper sells candles and soap. The honey is amazing. Supporting local and sustainable. Check out your area!,1767613758.4450638,handmade,reddit_sample,2026-02-12T11:49:18.462352+00:00
sample39,Negative review - am I being unfair?,Product was nice but arrived 2 weeks late with no warning. I left 3 stars. Seller messaged me upset. What would you do?,1767527358.4450638,Etsy,reddit_sample,2026-02-12T11:49:18.462352+00:00
sample40,Handmade jewelry care tips?,I buy a lot of artisan jewelry. How do you store and clean it to keep it looking good? Especially silver and natural stones.,1767440958.4450638,crafts,reddit_sample,2026-02-12T11:49:18.462352+00:00
sample41,First craft fair as a seller - lessons learned,Display matters a lot. Bring change. Have business cards. Talk to everyone. Already booked my next one!,1767354558.4450638,handmade,reddit_sample,2026-02-12T11:49:18.462352+00:00
sample42,Handmade leather journal - perfect for bullet journaling,"Thick paper, lay-flat binding. Seller does custom embossing. Got my initials on it. So happy with this purchase.",1767268158.4450638,handmade,reddit_sample,2026-02-12T11:49:18.462352+00:00
sample43,Recommendations for handmade baby gifts?,"Expecting a friend's baby. Want something unique - maybe a blanket, mobile, or keepsake. Safe and non-toxic please.",1767181758.4450638,crafts,reddit_sample,2026-02-12T11:49:18.462352+00:00
sample44,Terrible experience - item never arrived,Tracking said delivered but nothing at my door. Seller did not respond to messages. Had to do chargeback. Avoid.,1767095358.4450638,Etsy,reddit_sample,2026-02-12T11:49:18.462352+00:00
sample45,Handmade spices and seasonings,Small batch blends from a local maker. Game changer for cooking. Way better than supermarket. Supporting small biz!,1767008958.4450638,handmade,reddit_sample,2026-02-12T11:49:18.462352+00:00
sample46,Pricing handmade items - formula?,I do materials x 2 + hourly rate. Is that reasonable? Don't want to undercut others or price myself out.,1766922558.4450638,crafts,reddit_sample,2026-02-12T11:49:18.462352+00:00
sample47,Handmade wall art - mixed media,"Bought a piece that combines wood, metal, and paint. Stunning. Artist was at a local market. Follow them on IG now.",1766836158.4450638,handmade,reddit_sample,2026-02-12T11:49:18.462352+00:00
sample48,Etsy vs own website for handmade sales?,Currently on Etsy only. Traffic is good but fees add up. Anyone made the switch to their own site? How did it go?,1766749758.4450638,Etsy,reddit_sample,2026-02-12T11:49:18.462352+00:00
sample49,Handmade greeting cards - small business shoutout,Found a seller who does custom illustrations. Used them for holiday cards. Everyone asked where they were from. So unique!,1766663358.4450638,crafts,reddit_sample,2026-02-12T11:49:18.462352+00:00
sample50,Why I prefer handmade over Amazon,"Quality, uniqueness, and knowing who made it. Yes it costs more and takes longer. But it feels right. Anyone else?",1766576958.4450638,handmade,reddit_sample,2026-02-12T11:49:18.462352+00:00
